query,label
Where can I find information on our company's security policies and compliance procedures?,internal_docs
Is Elon Musk's net worth still above $200 billion after Tesla's recent quarterly earnings report?,web_search
Can we filter by client name and only show deals that have a high likelihood of closure?,crm_leads
What are our current quarterly sales targets for the healthcare industry?,crm_leads
"What's the average contract value for all deals in the ""demo"" stage?",crm_leads
What are our quarterly sales targets for the Q3 period?,crm_leads
How many contracts have been signed with clients from a specific industry (e.g. finance) over the past year?,crm_leads
Do we have any open vacation slots for the upcoming holiday season?,employee_db
What's the average contract value for all closed deals in the past 6 months?,crm_leads
How many vacation days do new hires receive in their first year with the company?,hr_policies
I'm looking for a list of all employees who work remotely at least 2 days a week.,employee_db
Does anyone else have a higher seniority level than Michael Brown?,employee_db
Can I use my company-issued laptop for personal projects outside of work hours?,hr_policies
How did the Dow Jones Industrial Average perform yesterday?,web_search
"Get me a report on all closed deals in the past 6 months with contract values above $200,000.",crm_leads
Are there any available resources containing information on recent natural disasters worldwide?,web_search
How many deals are currently being negotiated for closure within the next 60 days?,crm_leads
Are there any new leads from the recent trade show that need to be followed up on?,crm_leads
Can you provide me with a list of all clients who have signed contracts worth more than $500k in the past 6 months?,crm_leads
Is there a way to filter deals by region or industry for reporting purposes?,crm_leads
What's the current status of the Smith account in our sales pipeline?,crm_leads
Can you give me some insight into Google's recent AI advancements?,web_search
What is our company's policy on parental leave for adoptive parents?,hr_policies
What is the total contract value of all active deals in our pipeline right now?,crm_leads
What is the current market capitalization of Apple Inc. after their latest quarterly earnings report?,web_search
How many employees have a master's degree or higher in our company?,employee_db
I need to find all clients who have exceeded their quarterly sales targets by more than 10%.,crm_leads
How do I submit a request for a work-from-home arrangement?,hr_policies
Are there any specific rules or guidelines for reporting foreign gifts or benefits received from clients or vendors?,hr_policies
"I need to find out when Sarah Lee's birthday is, can you tell me her employee ID number?",employee_db
Is there a way to track which sales reps are responsible for closing deals over a certain value (e.g. $100k)?,crm_leads
What is the current PTO balance for employee ID 12345?,employee_db
Is there a cap on the number of dependents eligible for health insurance coverage through the company?,hr_policies
How do we submit expense reports for business travel and what are the reimbursement limits for meals and incidentals?,hr_policies
What is the company policy on taking breaks during the workday?,hr_policies
Can you show me Sarah Lee's performance metrics for the past quarter?,employee_db
"Can you retrieve a list of all active deals over $500,000 in value?",crm_leads
Do we have any employee wellness programs that focus on stress management and resilience?,hr_policies
What is the average tenure of employees in the marketing department?,employee_db
"I need to retrieve a list of all employees who have worked on project X, where can I find this information?",internal_docs
Can you find recent news articles about the ongoing COVID-19 pandemic in the US?,web_search
Do we have any discounts or perks for employees who participate in company-sponsored wellness programs?,hr_policies
Can you give me today's closing price for Apple Inc. stock?,web_search
What are the requirements for filing a formal complaint about workplace harassment?,hr_policies
Can you tell me what Sarah Lee's job description is currently?,employee_db
How do we currently handle and prioritize support tickets in our JIRA instance?,internal_docs
"Can you retrieve all active deals in the Americas region with a contract value over $100,000?",crm_leads
I need to find out if employee ID 34567 has any current performance goals that are not yet complete.,employee_db
Can you look up Jane Doe's salary history for the past year?,employee_db
What are some current trends in sustainable energy development?,web_search
Can you give me an overview of our company's current IT infrastructure and how it supports business operations?,internal_docs
Can you provide a detailed breakdown of the current project timeline?,internal_docs
Can you search our database for any open opportunities at General Electric?,crm_leads
Is there any recent news on the development of a COVID-19 vaccine by Moderna Therapeutics?,web_search
What are the key considerations when evaluating potential cloud service providers for our organization's needs?,internal_docs
How many new deals were added to the pipeline last week?,crm_leads
How did the European Union's economy perform in 2022 compared to previous years?,web_search
How many deals are we currently working on that are worth more than $200k each?,crm_leads
Has there been any significant news on climate change in the past week?,web_search
How do we currently handle incident response for service outages on weekends?,internal_docs
Can I take a short-term leave of absence to attend to a personal matter?,hr_policies
What are the guidelines for reporting an accident or injury in the workplace?,hr_policies
Are there any new leads from the online advertising campaign that need to be followed up on?,crm_leads
What's the current interest rate set by the Federal Reserve?,web_search
Are there any special considerations or accommodations for employees with disabilities?,hr_policies
Do we have any documentation on best practices for coding in Python?,internal_docs
Can you provide information on recent breakthroughs in cancer research?,web_search
What are our company's policies regarding gender-affirming care and family leave?,hr_policies
What are the key performance indicators for measuring successful project delivery in our organization?,internal_docs
How many deals are currently being managed by our sales team leader?,crm_leads
What's the total contract value of all deals with XYZ Corporation this quarter?,crm_leads
Is there a way to track employee commuting patterns and modes of transportation?,employee_db
Is there any news on the ongoing climate change negotiations at COP27?,web_search
How much did the S&P 500 drop last quarter?,web_search
Can you provide me with information on the company's history with major partnerships and collaborations?,internal_docs
Can you show me all active deals for the software division with a current value of at least $500k?,crm_leads
How many people have been affected by the recent wildfires in California according to official reports?,web_search
What is the current sales pipeline status for client Smithson Inc?,crm_leads
How do I submit an expense report when traveling internationally for business?,hr_policies
What are the top three clients we're working with this quarter on a contract worth over $200k?,crm_leads
What's the current state of the global oil production and demand?,web_search
Can you give me the latest news on NASA's Artemis program?,web_search
How many people have been vaccinated against COVID-19 globally so far?,web_search
What is the process for resolving disputes over work-life balance with managers or HR?,hr_policies
Are there any specific guidelines for submitting expense reports using company credit cards?,hr_policies
Do we have any company-wide policies or guidelines for handling confidential information while working remotely?,hr_policies
Where can I find detailed instructions on setting up a new developer workstation?,internal_docs
Do you have access to the latest job market data from the Bureau of Labor Statistics?,web_search
Are today's stock prices for Google's parent company Alphabet Inc. higher than they were last quarter?,web_search
Do you have any information on our company's standard sick leave policies including accrual rates and maximum usage limits?,hr_policies
How do I find out which employees are eligible for the new parental leave policy?,employee_db
What is the total value of all active deals in the software sector?,crm_leads
Are there any resources available for understanding the underlying infrastructure of our cloud-based services?,internal_docs
What is Tom Harris' current salary and bonus information?,employee_db
What is the standard procedure for reporting a security incident in the office?,hr_policies
What is the process for requesting a salary adjustment or bonus?,employee_db
How do I access Tom Harris's salary information from the past three years?,employee_db
Is there any news on the development of a new 5G network by Verizon in the United States?,web_search
Do we have any company-wide policies or guidelines for dealing with inclement weather while working remotely?,hr_policies
Where can I find the latest version of our project management guidelines for agile development?,internal_docs
How many clients have we closed this quarter so far?,crm_leads
"What are our current quarterly sales targets for each region, globally?",crm_leads
How do we typically handle and resolve conflicts or disputes within our development teams?,internal_docs
What is the process for requesting and approving a family leave under our parental leave policy?,hr_policies
What was the scope of work involved in the 2020 infrastructure upgrade project?,internal_docs
How do I update my password in the internal database?,internal_docs
Are there any notable changes to tax laws or regulations that I should be aware of?,web_search
How many employees have taken advantage of our flexible work-from-home policy?,employee_db
How many vacation days does Emily Chen have left in her bank?,employee_db
Can you show me a list of all employees in the marketing department who have more than 10 years of service?,employee_db
"How many paid vacation days do we get per year, and can they be carried over to the next year if not used?",hr_policies
Do we have any employees who are working remotely full-time?,employee_db
Do we offer any employee assistance programs for mental health support?,hr_policies
How do I access Michael Brown's training records and certifications?,employee_db
Do you have any information on the ongoing NASA Mars rover mission?,web_search
Can you provide a breakdown of quarterly sales targets by product line for Q2 and Q3?,crm_leads
Are there any specific rules or guidelines for reporting and reimbursing expenses related to employee relocation?,hr_policies
Is there a way to look up employee information by manager or department?,employee_db
Do we have any employees who are near or over the maximum PTO allotment for the year?,employee_db
Where can I find the latest version of our software development life cycle documentation?,internal_docs
Are there any recent changes to GDPR regulations?,web_search
Are there any guidelines for sharing company intellectual property on public platforms?,hr_policies
Can I take time off to attend my child's school event without prior approval?,hr_policies
"Do you have any information on our company's standard benefits package including health, dental, and vision insurance?",hr_policies
How do I request access to an employee's performance review?,employee_db
How many days of bereavement leave am I entitled to take?,hr_policies
"I need to access historical records on our company's IT asset management system, where do I start?",internal_docs
How many hours of overtime did Tom Johnson work in Q2 last year?,employee_db
Can I see a list of all clients we've worked with in the past year and their corresponding contract values?,crm_leads
"I need to analyze deal velocity - can you provide me with a list of all deals by their start date, sorted by close date?",crm_leads
What is the typical approval process for employee requests for temporary adjustments to their work schedule due to family emergencies?,hr_policies
Where can I find information on our company's data retention policies and GDPR compliance?,internal_docs
Where can I find information on the company's security protocols for sensitive data transmission?,internal_docs
What is the current market capitalization of Apple Inc.?,web_search
What is the current state of development for electric vehicle charging infrastructure?,web_search
What are the procedures for reporting and investigating suspected cases of workplace bullying?,hr_policies
Is there a database of notable cybersecurity conferences happening this year?,web_search
Can you point me to the relevant section in our standard operating procedures for handling sensitive data?,internal_docs
Are there any notable events happening this weekend that I should be aware of?,web_search
"What is the current status of the Johnson account, which was previously valued at $250,000?",crm_leads
Can you tell me how much vacation time Michael Brown has left this year?,employee_db
What is the process for handling and resolving software defects or bugs in production environments?,internal_docs
Is there a minimum amount of PTO required before taking parental leave?,hr_policies
What are the companywide PTO policies regarding summer hours?,employee_db
"Can you retrieve all deals with a start date within the last 3 months and contract value above $500,000?",crm_leads
How many quarterly sales targets did we exceed last year for the cloud services division?,crm_leads
What is the current ranking of the top 10 countries by nominal GDP per capita?,web_search
Can you show me a list of employees who have taken more than 10 days off in the past quarter?,employee_db
"What was the original vision and goals behind our company's flagship product ""SmartHome""?",internal_docs
Can we filter by region and only show deals that have a high likelihood of closure?,crm_leads
How do we typically handle and resolve software defects in production environments?,internal_docs
What is the average tenure of our engineering team members?,employee_db
What are the most recent updates on the development of self-driving cars?,web_search
What is the average contract value for deals won by our top-performing sales rep?,crm_leads
What is the average contract value of our deals in the sales pipeline right now?,crm_leads
What were the primary drivers behind our company's decision to adopt a DevOps approach?,internal_docs
What are the eligibility requirements for our employee stock purchase plan?,hr_policies
Can you give me the latest update on the COVID-19 vaccine development?,web_search
What was the initial architecture design for our flagship product in 2018?,internal_docs
What are our company's policies regarding same-sex partner benefits and family leave?,hr_policies
Is there a way to access data on global poverty rates and statistics?,web_search
How do I retrieve Emily Chen's personnel file from HR?,employee_db
Are there any specific rules or guidelines for reporting gifts and gratuities received from clients or vendors?,hr_policies
What is the process for requesting a flexible work schedule and who approves these requests?,hr_policies
What are the most recent performance review dates for team members in the software engineering department?,employee_db
What are the salary ranges for managers in our company across different departments?,employee_db
How has the global economy been affected by the pandemic so far?,web_search
What is the company's policy on carrying over unused PTO from one year to the next?,employee_db
Can you give me a report on our top-performing sales reps by quarterly sales targets met or exceeded?,crm_leads
How many contracts worth more than $500k have been signed in the past 12 months?,crm_leads
What is our company's policy on remote work arrangements for employees in managerial positions?,hr_policies
What is the typical process for escalating critical issues to upper management?,internal_docs
What is the average cost of a college education in the United States for the past 3 years?,web_search
Are there any ongoing investigations or scandals related to corporate malfeasance in the tech industry?,web_search
How has our company's approach to DevOps evolved over the past five years?,internal_docs
Can you provide a diagram illustrating the network topology used in our 2020 cloud migration project?,internal_docs
What were the key considerations when designing the original architecture for our flagship product?,internal_docs
Are there any standard operating procedures for handling code reviews and merge requests?,internal_docs
Can I use my company-issued laptop for personal use during non-work hours?,hr_policies
Who are some of the top performers in the data science team based on their most recent reviews?,employee_db
What is the average deal size of all deals that were closed in Q3?,crm_leads
What is the current unemployment rate in the state of California?,web_search
Do we have any clients named Johnson currently in the proposal stage?,crm_leads
What's the total value of all pending contracts in the northeast region?,crm_leads
I need to find all employees who have worked on project Z; can you give me their names and job titles?,employee_db
How do I request a flexible schedule to accommodate a doctor's appointment?,hr_policies
Can I use my paid time off to care for a sick family member?,hr_policies
Can I get a list of employees who have taken more than two weeks of PTO in the past six months?,employee_db
Do we have any standard operating procedures for handling critical errors in the manufacturing process?,internal_docs
Can you filter all active deals by region and provide a summary of each area's pipeline value?,crm_leads
What is the company policy on carryover PTO into the new year?,employee_db
Can you provide a step-by-step guide on how to troubleshoot common errors in our API gateway?,internal_docs
What are the current interest rates offered by major banks?,web_search
"Can you provide me with an overview of our active deals by product category, including a breakdown by region?",crm_leads
Is there a way to track the source of each new deal added to the pipeline?,crm_leads
Can I use my paid time off to care for an aging parent living in another country?,hr_policies
Can I work from home if my child is sick and I need to care for them?,hr_policies
What is John Smith's job title and department?,employee_db
Can you show me today's high and low stock prices for Apple Inc.?,web_search
Are there any standard operating procedures for deploying new code to production environments?,internal_docs
How does our company handle employee confidentiality agreements for new hires?,internal_docs
What are the current security protocols for remote access to our servers?,internal_docs
Can you show me a list of all employees who have been with us for more than 15 years?,employee_db
Are there any ongoing protests or demonstrations around the world related to climate change and environmental issues?,web_search
How many times has John Smith been promoted since joining our company?,employee_db
Is there a limit on the number of paid parental leave days available?,hr_policies
Can you provide me with a list of all clients who have exceeded their quarterly sales targets twice in the past year?,crm_leads
How do we go about requesting a reasonable accommodation under the Americans with Disabilities Act (ADA)?,hr_policies
Can you provide information on recent mergers and acquisitions in the tech industry?,web_search
"Can I see the personnel file for David Kim, specifically his education background?",employee_db
Where is the documentation for our custom-built workflow automation tool?,internal_docs
Can you find me an article on the impact of blockchain technology on supply chain management and logistics?,web_search
What are the top 5 highest-paid employees in our company right now?,employee_db
I need a summary of the top headlines from yesterday's Financial Times.,web_search
Can you explain the reasoning behind choosing React as our frontend framework of choice?,internal_docs
What is the current ranking of the top 10 most valuable companies in the world?,web_search
Can you give me a list of all active deals in the technology sector with contract values above $3 million?,crm_leads
What is the most recent update to our company's data encryption protocols?,internal_docs
Can you show me Sarah Lee's individual performance review from Q2 last year?,employee_db
Do we have any documentation on guidelines for writing technical reports?,internal_docs
Can you provide a breakdown of contract values by industry for all active deals?,crm_leads
Is there a way to view an employee's performance review from previous years?,employee_db
How do I request an extension on my existing PTO days?,employee_db
I need to know if Maria Rodriguez has used all her available vacation time this year.,employee_db
Can you provide me with a list of recent NASA missions to Mars?,web_search
"What is our company's policy on using company resources (e.g., phones, laptops) for personal use?",hr_policies
How many people were affected by the recent natural disaster in Japan?,web_search
What is the average cost of a gallon of gasoline in the United States for the past year?,web_search
"What is John Smith's PTO balance, and how many days does he need to take off before it rolls over?",employee_db
Can you give me a breakdown of contract values by region or industry for the past year?,crm_leads
How many people have been affected by the recent floods in Bangladesh according to UN reports?,web_search
What are the rules regarding outside employment or consulting while working at the company?,hr_policies
Can you show me the salary range for a new hire in the marketing department?,employee_db
Are there any available databases containing information on ongoing space missions?,web_search
